item,spec,supplier_or_search_terms,price_each,date_checked,lead_time,substitution_rule,risk
Natural horn blank,"Domesticated cow/ox/goat/sheep horn, closed tip, cleanable interior",cow horn blank ox horn craft horn goat horn instrument blank,TBD live check,,TBD,Do not use endangered species; reject cracked or delaminated blanks,"Each horn has different volume and curvature, so every blank is tuned empirically"
Casting slip,White stoneware or porcelain casting slip; shrinkage data required,ceramic casting slip cone 6 porcelain stoneware gallon,TBD live check,,TBD,Must provide shrinkage and firing cone,Shrinkage variation changes all dimensions and pitch
Pottery plaster,No. 1 pottery plaster or equivalent mold plaster,pottery plaster mold plaster 50 lb,TBD live check,,TBD,"Use ceramic mold plaster, not construction plaster",Poor absorption causes slow wall growth and release trouble
Hardwood block stock,"Fine-grain stable hardwood blanks, 1/2 to 2 in depending size",cedar pear maple turning blank instrument block,TBD live check,,TBD,Avoid resinous or mouth-unsafe finishes,Block swelling or warping changes windway
Leather/cork gasket,"Thin natural leather, cork sheet, or mouth-safe gasket material",thin cork gasket sheet leather scrap beeswax,TBD live check,,TBD,Must seal without shedding dust,Leaks make voicing unstable
Tuning ring material,Thin brass strip/tube or leather collar,thin brass strip tube hobby K&S brass,TBD live check,,TBD,Collar must rotate smoothly and not chip clay,Rough collar damages vent edge
